{
  "format": "alang-token-positive-qualification-contract-v1",
  "tokenizers": [
    {"profile_id": "tiktoken-0.12.0-cl100k-base", "vocabulary_path": "assets/compact-projection-fidelity/phase-02/tokenizers/cl100k_base.tiktoken", "vocabulary_sha256": "223921b76ee99bde995b7ff738513eef100fb51d18c93597a113bcffe865b2a7"},
    {"profile_id": "tiktoken-0.12.0-o200k-base", "vocabulary_path": "assets/compact-projection-fidelity/phase-02/tokenizers/o200k_base.tiktoken", "vocabulary_sha256": "446a9538cb6c348e3516120d7c08b09f57c36495e2acfffe59a5bf8b0cfb1a2d"}
  ],
  "tokenizer_directory": "assets/compact-projection-fidelity/phase-02/tokenizers",
  "cases": 48,
  "protocols": 4,
  "conditions": 2,
  "thresholds": {
    "every_document_strictly_cheaper": true,
    "every_full_request_strictly_cheaper": true,
    "minimum_aggregate_document_savings_basis_points": 500,
    "minimum_median_document_savings_basis_points": 500,
    "minimum_aggregate_request_savings_basis_points": 500,
    "minimum_median_request_savings_basis_points": 500
  },
  "attribution_categories": ["layout", "vocabulary", "identifiers", "facts", "paths", "budgets", "authority", "completion", "legends", "instructions", "output-scaffolding"],
  "registration": {
    "phase1_assets": "all-json",
    "phase2_contracts": ["candidate-contract-v1", "protocol-contract-v1", "qualification-contract-v1"],
    "external_references": "all-digest-pinned",
    "trusted_modules": ["candidate", "protocol", "qualification", "authorization"],
    "authorization_contract_excluded_from_digest": true
  },
  "live_authorization": {
    "network_default": "disabled",
    "environment_variable": "ALANG_ALLOW_MNEMONIC_MODEL_CALLS",
    "required_value": "1",
    "qualification_digest_required": true,
    "any_drift": "reject"
  }
}
